2025-05-06 12:33:54.089,Plat côté Terre,3300,PLAT,"Rable de lapin farce herbes-poireaux, jus à la sauge,arancini cœur mozza-herbes, crème d'artichaut aux agrumes, salade d'aubergines et poivrons rôtis, vinaigrette balsamique.",http://auptitcafe.nc/wp-content/uploads/2025/05/APC-MENU-DU-MARDI00.jpg
2025-05-06 12:33:54.089,Plat côté Mer,3300,PLAT,"Mi-cuit de thon jaune, crème avocat-concombre-wazabi,salade de udon aux légumes marinés, tempura de crevette,salade de choux-wakame-sésame.",http://auptitcafe.nc/wp-content/uploads/2025/05/APC-MENU-DU-MARDI01.jpg
2025-05-06 12:33:54.089,Plat Végétarien,2950,PLAT,"Arancini coeur mozza-herbes, crème d'artichaut aux agrumes, salade d'aubergine et poivrons rôtis,houmous, mesclun d'herbes",http://auptitcafe.nc/wp-content/uploads/2025/05/APC-MENU-DU-MARDI02.jpg
2025-05-06 12:33:54.089,Salade du mois de mail ,2750,PLAT,"Banh bao au canard-citronnelle, condiment cream cheese-ail-gingembre, blanc de poulet rôti,salade mélangée.",http://auptitcafe.nc/wp-content/uploads/2025/05/APC-MENU-DU-MARDI03.jpg
2025-05-06 12:33:54.089,Sugestion du soir-,3300,PLAT,"Basse côte de bœuf confite sauce vin rouge-miso-citronnelle,purée de pomme de terre, salade et poivrons rôtis.",http://auptitcafe.nc/wp-content/uploads/2022/11/VISUEL-PHOTO.jpg
2025-05-06 12:33:54.089,POE-,1200,DESSERT,"Poé citrouille, crumble combawa,salade de fruits, sorbet jamelon.",http://auptitcafe.nc/wp-content/uploads/2025/05/APC-MENU-DU-MARDI05.jpg
2025-05-06 12:33:54.089,FINANCIER-,1200,DESSERT,"Financier amande vanille,mousse chocolat au lait, coeur fruits rouges, feuillantine praliné.",http://auptitcafe.nc/wp-content/uploads/2025/05/APC-MENU-DU-MARDI04.jpg
2025-05-06 12:33:54.089,L'incontournable,1200,DESSERT,"Le cheese-cake maison du p’tit café, à la mangue et au fruit de la passion",http://auptitcafe.nc/wp-content/uploads/2024/11/24100406.jpg
2025-05-06 12:33:54.089,Le café gourmand,1100,DESSERT,"C’est une bonne alternative, servi avec 3 minis desserts du jour",http://auptitcafe.nc/wp-content/uploads/2025/04/2025040707.jpg
