menu_date,titre_plat,prix,category,recette,image_url
2023-06-20 12:22:03.511,Plat côté Terre,3300,PLAT,"Pastilla de tajine d'agneau, brochette de filet mignon, taboulet de choux fleur, romesco harissa, tzatziki, courgette grillée, chimichourri.",http://auptitcafe.nc/wp-content/uploads/2023/06/23062000-scaled.jpg
2023-06-20 12:22:03.511,Plat côté Mer,3300,PLAT,"Rouget de nuit, gratin de penne a l’encre de seiche, poutargue, crème oseille épinard, champignon escabèche, pistou basilic pistache.",http://auptitcafe.nc/wp-content/uploads/2023/06/23062001-scaled.jpg
2023-06-20 12:22:03.511,Plat Végétarien,2900,PLAT,"Taboulet de choux fleur, courgette grillée, sauce tzatziki, champignon escabèche, houmous, romesco, salade mélangée.",http://auptitcafe.nc/wp-content/uploads/2023/06/23062002-scaled.jpg
2023-06-20 12:22:03.511,Suggestion du mois,2650,PLAT,"Ventrèche de thon confite, salade mélangée, sauce tonato, accras de poisson, parmesan,",http://auptitcafe.nc/wp-content/uploads/2023/06/23060603.jpg
2023-06-20 12:22:03.511,Suggestion du soir,3300,PLAT,"Civet de cerf Mole, rösti de taro de montagne, poêlée de champignon, châtaigne, oignon grelot.",
2023-06-20 12:22:03.511,OPERA MATCHA,1200,DESSERT,"Opéra thé matcha: biscuit amande, suprême chocolat blanc thé macha, ganache chocolat noir.",http://auptitcafe.nc/wp-content/uploads/2023/06/23062005-scaled.jpg
2023-06-20 12:22:03.511,TARTE ORANGE BASILIC,1200,DESSERT,"Tarte orange basilic: pate sucrée, crème d'amande basilic, crémeux orange basilic.",http://auptitcafe.nc/wp-content/uploads/2023/06/23062004-scaled.jpg
2023-06-20 12:22:03.511,L'incontournable,1200,DESSERT,"Le cheese-cake maison du p’tit café, à la mangue et au fruit de la passion",http://auptitcafe.nc/wp-content/uploads/2022/11/APC-MENU-DU-MARDI06-scaled.jpg
2023-06-20 12:22:03.511,Le café gourmand,1100,DESSERT,"C’est une bonne alternative, servi avec 3 minis desserts du jour",http://auptitcafe.nc/wp-content/uploads/2023/03/APC-MENU-DU-MARDI-scaled.jpg
