2023-07-04 12:25:25.505,Plat côté Terre,3300,PLAT,"Escalope de veau à la milanaise, salade-jambon cru-parmesan-croûton-tomate séchée sauce césar, purée de squash,bok shoî grillé, sauce aox morille..",http://auptitcafe.nc/wp-content/uploads/2023/07/23070401.jpg
2023-07-04 12:25:25.505,Plat côté Mer,3300,PLAT,"Filet de picot kanak, gratin de patate douce, salade de brède-coco-combawa, beurre blanc vanillé, rougail de tomate.",http://auptitcafe.nc/wp-content/uploads/2023/07/23070400.jpg
2023-07-04 12:25:25.505,Plat Végétarien,2900,PLAT,"Gratin de patate douce, salade de brède - coco - combawa, salade mélangée, velouté de citrouille",http://auptitcafe.nc/wp-content/uploads/2023/07/23070402.jpg
2023-07-04 12:25:25.505,Suggestion du mois,2650,PLAT,"Soupe de citrouille-galanga,carotte au mizo,crevette sautée, cacahuète au tandoori, couteau gratiné.",http://auptitcafe.nc/wp-content/uploads/2023/07/23070403.jpg
2023-07-04 12:25:25.505,Suggestion du soir,3300,PLAT,"Rable de lapin farci moutarde-cacahuète, riz pilaf, carotte glacées, jus de cuisson.",http://auptitcafe.nc/wp-content/uploads/2022/11/VISUEL-PHOTO.jpg
2023-07-04 12:25:25.505,MACARON,1200,DESSERT,"Macaron, ganache montée chocolat noir, feuillantine praliné, insert crème brulée baileys-orange, glace café",http://auptitcafe.nc/wp-content/uploads/2023/07/23070404.jpg
2023-07-04 12:25:25.505,GATEAU NANTAIS,1200,DESSERT,"Gâteau nantais, pomme rôtie, mascarpone tonka.",http://auptitcafe.nc/wp-content/uploads/2023/07/23070405.jpg
2023-07-04 12:25:25.505,L'incontournable,1200,DESSERT,"Le cheese-cake maison du p’tit café, à la mangue et au fruit de la passion",http://auptitcafe.nc/wp-content/uploads/2022/11/APC-MENU-DU-MARDI06-scaled.jpg
2023-07-04 12:25:25.505,Le café gourmand,1100,DESSERT,"C’est une bonne alternative, servi avec 3 minis desserts du jour",http://auptitcafe.nc/wp-content/uploads/2023/03/APC-MENU-DU-MARDI-scaled.jpg
