menu_date,titre_plat,prix,category,recette,image_url
2023-10-03 12:21:12.478,Plat côté Terre,3300,PLAT,"Quasi de veau confit au beurre noisette, crumble abricot-amande, écrasé de pomme de terre à la moutarde, citrouille rôtie, salade de copeaux de légumes, jus  de cuisson à la bière.",http://auptitcafe.nc/wp-content/uploads/2023/10/23100301.jpg
2023-10-03 12:21:12.478,Plat côté Mer,3300,PLAT,"Rouget de nuit sauce encre de seiche, linguine-courgette-petit pois-tomate séchée au beurre de combawa,brocolis,marmelade de tomate-galanga.",http://auptitcafe.nc/wp-content/uploads/2023/10/23100300.jpg
2023-10-03 12:21:12.478,Plat Végétarien,2900,PLAT,"Ecrassé de pomme de terre à la moutarde, citrouille rôtie,brocolis, marmelade de tomate-galanga, salade de légumes en copeaux, soupe de carotte.",http://auptitcafe.nc/wp-content/uploads/2023/10/23100302.jpg
2023-10-03 12:21:12.478,Suggestion du mois,2650,PLAT,"Porc croustillant, salade de papaye verte à la thaï,frites de manioc,condiment satay.",http://auptitcafe.nc/wp-content/uploads/2023/10/23100303.jpg
2023-10-03 12:21:12.478,Suggestion du soir,3300,PLAT,"Tsukune à la bisque de crevette-poulpe-seiche, poireau grillé et pomme de terre,aïoli, condiment poireau fumé.",http://auptitcafe.nc/wp-content/uploads/2023/10/TSUKUNE-scaled.jpeg
2023-10-03 12:21:12.478,TAROFFEE,1200,DESSERT,"Biscuit spéculos,taro de montagne confit à la vanille,caramel,mascarpone vanille.",http://auptitcafe.nc/wp-content/uploads/2023/10/23100305.jpg
2023-10-03 12:21:12.478,BROOKIES,1200,DESSERT,"Brownies et cookies mousse chocolat, coulis chocolat au lait de coco, glace coco.",http://auptitcafe.nc/wp-content/uploads/2023/10/23100304.jpg
2023-10-03 12:21:12.478,L'incontournable,1200,DESSERT,"Le cheese-cake maison du p’tit café, à la mangue et au fruit de la passion",http://auptitcafe.nc/wp-content/uploads/2022/11/APC-MENU-DU-MARDI06-scaled.jpg
2023-10-03 12:21:12.478,Le café gourmand,1100,DESSERT,"C’est une bonne alternative, servi avec 3 minis desserts du jour",http://auptitcafe.nc/wp-content/uploads/2023/09/APC-MENU-DU-MARDI06-2.jpg
