2023-09-12 12:20:18.368,Plat côté Terre,3300,PLAT,"Piccata de cerf, samoussa,polenta grillée,caviar d'aubergine,artichaut à la grecque,salade de copeaux de courgette et carotte,jus au basilic.",http://auptitcafe.nc/wp-content/uploads/2023/09/23091200-5.jpg
2023-09-12 12:20:18.368,Plat côté Mer,3300,PLAT,"Rouget de nuit,risotto aux champignons,légumes vert,tempura de courgette, pesto persil-noisette, jus perlé.",http://auptitcafe.nc/wp-content/uploads/2023/09/23091201.jpg
2023-09-12 12:20:18.368,Plat Végétarien,2900,PLAT,"Polenta grillée, artichaut à la grecque, caviar d'aubergine,tomate rôtie,salade de copeaux courgette et carotte,velouté de carotte.",http://auptitcafe.nc/wp-content/uploads/2023/09/23091202.jpg
2023-09-12 12:20:18.368,Suggestion du mois,2650,PLAT,"Velouté de carotte, arancini, poêlées de champignons, billes de mozzarella, graines de sarrasin.",http://auptitcafe.nc/wp-content/uploads/2023/09/APC-MENU-DU-MARDI03.jpg
2023-09-12 12:20:18.368,Suggestion du soir,3300,PLAT,"Kefta de poulet aux épices, palet de millet,pois chiche-légumes-bouillon de couscous,gel citron-miel-piment.",http://auptitcafe.nc/wp-content/uploads/2022/11/VISUEL-PHOTO.jpg
2023-09-12 12:20:18.368,BABA,1200,DESSERT,"Baba au rhum,ananas rôti,espuma vanille.",http://auptitcafe.nc/wp-content/uploads/2023/09/23091205.jpg
2023-09-12 12:20:18.368,3 CHOCOLAT,3,DESSERT,"Biscuit brownie chocolat noir, crémeux chocolat au lait,ganache chocolat blanc.",http://auptitcafe.nc/wp-content/uploads/2023/09/23091204.jpg
2023-09-12 12:20:18.368,L'incontournable,1200,DESSERT,"Le cheese-cake maison du p’tit café, à la mangue et au fruit de la passion",http://auptitcafe.nc/wp-content/uploads/2022/11/APC-MENU-DU-MARDI06-scaled.jpg
2023-09-12 12:20:18.368,Le café gourmand,1100,DESSERT,"C’est une bonne alternative, servi avec 3 minis desserts du jour",http://auptitcafe.nc/wp-content/uploads/2023/08/23080806.jpg
