2025-02-11 12:28:05.636,Plat côté Terre,3300,PLAT,"AGNEAU: Epaule  façon tajine et brochette mariné sauce chimichurri, salade d'aubergines rôties-poivrons-oignons-tomates séchées-coriande-basilic,houmous,salade mélangée.",http://auptitcafe.nc/wp-content/uploads/2025/02/250210-SUR-PLACE00.jpg
2025-02-11 12:28:05.636,Plat côté Mer,3300,PLAT,"Mahi-Mahi croûte d'herbes,beurre blanc aux poivrons,risotto vert-couteaux-basilic thaï,salade mélangée à la roquette,bok shoï.",http://auptitcafe.nc/wp-content/uploads/2025/02/250210-SUR-PLACE01.jpg
2025-02-11 12:28:05.636,Plat Végétarien,2950,PLAT,"Salade d'aubergines-poivrons-oignons-tomates séchées-coriande, choux chine sautés, salade de riz, salade mélangée.",http://auptitcafe.nc/wp-content/uploads/2025/02/250210-SUR-PLACE02.jpg
2025-02-11 12:28:05.636,Salade du mois de février ,2750,PLAT,"Effiloché de raie, salade de pomme de terre-câpre-tomate séchée-fromage blanc-oeuf mimosa, salade mélangée.",http://auptitcafe.nc/wp-content/uploads/2025/02/25020302.jpg
2025-02-11 12:28:05.636,Sugestion du soir-,3300,PLAT,"Échine de porc au lait,croquette de manioc et patate douce, légumes sautées,salade mélangée.",http://auptitcafe.nc/wp-content/uploads/2022/11/VISUEL-PHOTO.jpg
2025-02-11 12:28:05.636,MACARON-,1200,DESSERT,"Macaron: biscuit cuillère pistache,mousse framboise, sorbet cassis,coulis de fruits rouges",http://auptitcafe.nc/wp-content/uploads/2025/02/250210-SUR-PLACE04.jpg
2025-02-11 12:28:05.636,CHOCO-PRALINE-,1200,DESSERT,"Biscuit traou cacao, crémeux praliné, ganache chocolat noir,coulis chocolat.",http://auptitcafe.nc/wp-content/uploads/2025/02/250210-SUR-PLACE05.jpg
2025-02-11 12:28:05.636,L'incontournable,1200,DESSERT,"Le cheese-cake maison du p’tit café, à la mangue et au fruit de la passion",http://auptitcafe.nc/wp-content/uploads/2024/11/24100406.jpg
2025-02-11 12:28:05.636,Le café gourmand,1100,DESSERT,"C’est une bonne alternative, servi avec 3 minis desserts du jour",http://auptitcafe.nc/wp-content/uploads/2024/11/24100407.jpg
