2026-06-09 14:42:17.833876,Plat côté Terre,3300,PLAT,"Épaule de veau confite-grillée,grémolata,conchiglioni farce épinard et champignon,salade de courgette rôtie-pignon-câpre-tomate,salade de copeaux de légumes,crème d’artichaut.",http://auptitcafe.nc/wp-content/uploads/2026/06/260609-SUR-PLACE_1-scaled.jpg
2026-06-09 14:42:17.833876,Plat côté Mer,3300,PLAT,"Quenelle de loche ronde,jus bouillabaisse poulpe, champignon en barigoule,poireau et choux fleur,toast rouille,pomme de terre,salade d'herbes.",http://auptitcafe.nc/wp-content/uploads/2026/06/260609-SUR-PLACE_2-scaled.jpg
2026-06-09 14:42:17.833876,Plat Végétarien,2950,PLAT,"Salade de courgette rôtie-pignon-câpre-tomate,salade de copeaux de légumes,conchiglioni parce épinard-champignon,crème d'artichaut,champignons en barigoule.",http://auptitcafe.nc/wp-content/uploads/2026/06/260609-SUR-PLACE_3-scaled.jpg
2026-06-09 14:42:17.833876,Soupe du mois,2750,PLAT,"Velouté de citrouille,kefta d'agneau,coriandre fraiche,dukkah,mozzarella,croutons aillés.",http://auptitcafe.nc/wp-content/uploads/2026/06/1PC-VSP-260601_4-scaled.jpg
2026-06-09 14:42:17.833876,Sugestion du soir,3300,PLAT,"Émietté de cuisse de canard façon tajine, salade boulgour et quinoa,houmous, salade mélangée.",http://auptitcafe.nc/wp-content/uploads/2022/11/VISUEL-PHOTO.jpg
2026-06-09 14:42:17.833876,DÔME,1200,DESSERT,"Biscuit diamant cacao,cheese cake cuit,dôme mascarpone insert chocolat,coulis chocolat.",http://auptitcafe.nc/wp-content/uploads/2026/06/260609-SUR-PLACE_6-scaled.jpg
2026-06-09 14:42:17.833876,CREME BRULEE,1200,DESSERT,"Crème brulée à la vanille,sorbet cassis,financier amande-coco-pandan,tuile amande.",http://auptitcafe.nc/wp-content/uploads/2026/06/260609-SUR-PLACE_5-scaled.jpg
2026-06-09 14:42:17.833876,L'incontournable,1200,DESSERT,"Le cheese-cake maison du p’tit café, à la mangue et au fruit de la passion",http://auptitcafe.nc/wp-content/uploads/2025/11/APC-MENU-DU-MARDI06.jpg
2026-06-09 14:42:17.833876,Le café gourmand,1100,DESSERT,"C’est une bonne alternative, servi avec 3 minis desserts du jour",http://auptitcafe.nc/wp-content/uploads/2025/11/APC-MENU-DU-MARDI07.jpg
