menu_date,titre_plat,prix,category,recette,image_url
2024-10-01 12:28:12.605,Plat côté Terre,3300,PLAT,"BURGER: pain challah au pavot,émietté de canard-confit d'oignons-zeste d'orange-tomate-crème de conté-moutarde champignons, coleslaw de papaye verte,frite d'igname,ketchup banane,salade mélangée.",http://auptitcafe.nc/wp-content/uploads/2024/09/APC-MENU-DU-MARDI00-3-scaled.jpg
2024-10-01 12:28:12.605,Plat côté Mer,3300,PLAT,"Filet de loche ronde,bouillon thaï,nouilles jaunes-légumes sautés,beignet de tentacule de seiche,mesclun d'herbes et cacahuètes.",http://auptitcafe.nc/wp-content/uploads/2024/09/APC-MENU-DU-MARDI01-3-scaled.jpg
2024-10-01 12:28:12.605,Plat Végétarien,2950,PLAT,"BURGER VG:pain challah au pavot,steak haricots rouges et patate douce-confit d'oignons-zeste d'orange-tomate-crème de conté-moutarde champignons, coleslaw de papaye verte,frite d'igname,ketchup banane,salade mélangée",http://auptitcafe.nc/wp-content/uploads/2024/09/APC-MENU-DU-MARDI00-3-scaled.jpg
2024-10-01 12:28:12.605,Salade du mois d'octobre,2750,PLAT,"Salade de poulpe-pomme de terre-patate douce-câpre-pickles, condiment romesco,salade mélangée.",http://auptitcafe.nc/wp-content/uploads/2024/09/APC-MENU-DU-MARDI03-2-scaled.jpg
2024-10-01 12:28:12.605,Sugestion du soir-,3300,PLAT,"Paleron de bœuf confit-grillé,sauce cacao-tamarin,polenta crémeuse,poireaux rôtis,salade d'herbes.",http://auptitcafe.nc/wp-content/uploads/2022/11/VISUEL-PHOTO.jpg
2024-10-01 12:28:12.605,ETON MESS-,1200,DESSERT,"Meringue, fromage blanc-corossol-miel, coulis de fruits rouges,kiwi.",http://auptitcafe.nc/wp-content/uploads/2024/09/APC-MENU-DU-MARDI04-3-scaled.jpg
2024-10-01 12:28:12.605,ENTREMETS CHOCOLAT-,1200,DESSERT,"Dacquoise noisette,croustillant praliné,crémeux chocolat,chantilly chocolat au lait.",http://auptitcafe.nc/wp-content/uploads/2024/09/APC-MENU-DU-MARDI05-3-scaled.jpg
2024-10-01 12:28:12.605,L'incontournable,1200,DESSERT,"Le cheese-cake maison du p’tit café, à la mangue et au fruit de la passion",http://auptitcafe.nc/wp-content/uploads/2024/07/24072306.jpg
2024-10-01 12:28:12.605,Le café gourmand,1100,DESSERT,"C’est une bonne alternative, servi avec 3 minis desserts du jour",http://auptitcafe.nc/wp-content/uploads/2024/08/APC-MENU-DU-MARDI07-scaled.jpg
