menu_date,titre_plat,prix,category,recette,image_url
2024-03-19 12:19:45.341,Plat côté Terre,3300,PLAT,"Magret de canard,toast de mousse de foie de volaille,rösti de pomme de terre et patate douce,salade mélangée à la roquette-pomme-cèleri,condiment artichaut, jus au vinaigre de framboise.",http://auptitcafe.nc/wp-content/uploads/2024/03/24031901.jpg
2024-03-19 12:19:45.341,Plat côté Mer,3300,PLAT,"Filet de Saumonée,sauce tigre qui pleure, banh xéo crevette-seiche-soja,pickles,salade d'herbes,bok shoi grillé.",http://auptitcafe.nc/wp-content/uploads/2024/03/24031900.jpg
2024-03-19 12:19:45.341,Plat Végétarien,2950,PLAT,"Purée d'artichaut,salade mélangée à la roquette-pomme-noix,bok shoi grillé,banh xéo au soja.",http://auptitcafe.nc/wp-content/uploads/2024/03/24031902.jpg
2024-03-19 12:19:45.341,Suggestion du mois,2950,PLAT,"Tartare de boeuf, burrata, salade mélangée, croutons à l'ail,pistou.",http://auptitcafe.nc/wp-content/uploads/2024/03/24031202.jpg
2024-03-19 12:19:45.341,Suggestion du soir,3300,PLAT,"Rendang de cerf,MWATA: feuille de choux kanak-taro-banane poingo-coco,salade mélangée.",http://auptitcafe.nc/wp-content/uploads/2024/03/rendang-scaled.jpeg
2024-03-19 12:19:45.341,TARTELETTE,1200,DESSERT,"Pâte sucrée.crème d'amande,compotée de poire,praliné et mousse noisette.",http://auptitcafe.nc/wp-content/uploads/2024/03/24031904.jpg
2024-03-19 12:19:45.341,ENTREMETS,1200,DESSERT,"Biscuit financier,insert framboise,ganache chocolat noir et lait.",http://auptitcafe.nc/wp-content/uploads/2024/03/24031905.jpg
2024-03-19 12:19:45.341,L'incontournable,1200,DESSERT,"Le cheese-cake maison du p’tit café, à la mangue et au fruit de la passion",http://auptitcafe.nc/wp-content/uploads/2022/11/APC-MENU-DU-MARDI06-scaled.jpg
2024-03-19 12:19:45.341,Le café gourmand,1100,DESSERT,"C’est une bonne alternative, servi avec 3 minis desserts du jour",http://auptitcafe.nc/wp-content/uploads/2023/09/APC-MENU-DU-MARDI06-2.jpg
