2024-04-02 12:20:15.178,Plat côté Terre,3300,PLAT,"Shawarma :  pain pita-d'agneau-salade-tzatziki,caviar d'aubergine,falafels,salade de fevettes-légumes grillés,tomate-concombre",http://auptitcafe.nc/wp-content/uploads/2024/04/24040200-scaled.jpg
2024-04-02 12:20:15.178,Plat côté Mer,3300,PLAT,"Filet de loche ronde,bisque de crevettes,quiche langouste-poireaux-abricot-moutarde, purée de carotte-fenouil, salade d'herbes.",http://auptitcafe.nc/wp-content/uploads/2024/04/24040201-scaled.jpg
2024-04-02 12:20:15.178,Plat Végétarien,2950,PLAT,"Salade de légumes grillés et fevettes,pain pita-tzatziki,caviar d'aubergine,salade tomate-concombre,purée de carotte-fenouil",http://auptitcafe.nc/wp-content/uploads/2024/04/24040202-scaled.jpg
2024-04-02 12:20:15.178,Suggestion du mois,2650,PLAT,"Poulet mariné coco-tandoori,salade de pâte udon aux légumes, condiment saté,,salade mélangée.",http://auptitcafe.nc/wp-content/uploads/2024/04/24040203-scaled.jpg
2024-04-02 12:20:15.178,Suggestion du soir,3300,PLAT,"Parmentier de bœuf à la purée d'igname-pomme de terre,jus au pistou, salade'd'endives-parmesan-noix-dukkah.",http://auptitcafe.nc/wp-content/uploads/2024/04/parmentier-02-04-24-scaled.jpeg
2024-04-02 12:20:15.178,TIRAMISU,1200,DESSERT,"Biscuit cuillère chocolat,mascarpone, ganache gianduja, espuma marron-kumquat.",http://auptitcafe.nc/wp-content/uploads/2024/04/24040205-scaled.jpg
2024-04-02 12:20:15.178,ENTREMETS PECHE,1200,DESSERT,"Pain de gênes pistache, compotée de pêches, mousse framboise, pêche rôtie.",http://auptitcafe.nc/wp-content/uploads/2024/04/24040204-scaled.jpg
2024-04-02 12:20:15.178,L'incontournable,1200,DESSERT,"Le cheese-cake maison du p’tit café, à la mangue et au fruit de la passion",http://auptitcafe.nc/wp-content/uploads/2022/11/APC-MENU-DU-MARDI06-scaled.jpg
2024-04-02 12:20:15.178,Le café gourmand,1100,DESSERT,"C’est une bonne alternative, servi avec 3 minis desserts du jour",http://auptitcafe.nc/wp-content/uploads/2023/09/APC-MENU-DU-MARDI06-2.jpg
