menu_date,titre_plat,prix,category,recette,image_url
2023-08-22 12:19:49.873,Plat côté Terre,3300,PLAT,"Carré de porc rôti-laqué,salade de lentille-chorizo-ananas,polenta crémeuse, salade mélangée, croustillant de boudin noir, condiment moutarde-miel-romarin.",http://auptitcafe.nc/wp-content/uploads/2023/08/23082200.jpg
2023-08-22 12:19:49.873,Plat côté Mer,3300,PLAT,"Mi-cuit de thon sauce hollandais,kumquat,pomme de terre en persillade ,tomate cerise rôtie-haricot vert-bok shoi,salade d'herbes.",http://auptitcafe.nc/wp-content/uploads/2023/08/23082201.jpg
2023-08-22 12:19:49.873,Plat Végétarien,2900,PLAT,"Polenta crémeuse,salade de lentille-ananas, tomate cerise rôtie-haricot vert-bok shoi,velouté de citrouille.",http://auptitcafe.nc/wp-content/uploads/2023/08/23082202.jpg
2023-08-22 12:19:49.873,Suggestion du mois,2650,PLAT,"Soupe de lentille verte au citron keffir, spaetzel, éffiloché de queue de boeuf et lardon au balsamique.",http://auptitcafe.nc/wp-content/uploads/2023/08/23080103.jpg
2023-08-22 12:19:49.873,Suggestion du soir,3300,PLAT,"Pavé de saumon à la plancha, crème d'oseille,crevette croustillante, gnocchi de pomme de terre, fruits de mer,carotte et cèleri, mesclun de salade.",http://auptitcafe.nc/wp-content/uploads/2022/11/VISUEL-PHOTO.jpg
2023-08-22 12:19:49.873,RIZ AU LAIT,1200,DESSERT,"Riz au lait chocolat,croustillant poire-cacahuète,caramel.",http://auptitcafe.nc/wp-content/uploads/2023/08/23082205.jpg
2023-08-22 12:19:49.873,PAVLOVA,1200,DESSERT,"Meringue moelleuse,crémeux pistache, kumquat et kiwi.",http://auptitcafe.nc/wp-content/uploads/2023/08/23082204.jpg
2023-08-22 12:19:49.873,L'incontournable,1200,DESSERT,"Le cheese-cake maison du p’tit café, à la mangue et au fruit de la passion",http://auptitcafe.nc/wp-content/uploads/2022/11/APC-MENU-DU-MARDI06-scaled.jpg
2023-08-22 12:19:49.873,Le café gourmand,1100,DESSERT,"C’est une bonne alternative, servi avec 3 minis desserts du jour",http://auptitcafe.nc/wp-content/uploads/2023/08/23080806.jpg
