menu_date,titre_plat,prix,category,recette,image_url
2025-08-05 12:38:06.649,Plat côté Terre,3300,PLAT,"Veau farci au jambon de parme et brie,risotto à la crème de champignon-ail-persil,butternut rôti miel-amande,salade d'endive-cèleri-noix,jus balsamique.",http://auptitcafe.nc/wp-content/uploads/2025/08/APC-MENU-DU-MARDI00.jpg
2025-08-05 12:38:06.649,Plat côté Mer,3300,PLAT,"Mi-cuit de thon jaune grillé,sauce à la moule,petit pois-haricot vert-cèleri-pomme de terre-oignon grelot,fruits de mer,salade d'herbes",http://auptitcafe.nc/wp-content/uploads/2025/08/APC-MENU-DU-MARDI01.jpg
2025-08-05 12:38:06.649,Plat Végétarien,2950,PLAT,"Risotto à la crème de champignon,butternut rôti miel et amande,haricot vert-cèleri-pomme de terre-oignon grelot,salade mélangée.",http://auptitcafe.nc/wp-content/uploads/2025/08/APC-MENU-DU-MARDI02.jpg
2025-08-05 12:38:06.649,Soupe du mois d'AOUT ,2750,PLAT,"Soupe de citrouille,épices,oeuf croustillant, parmesan-shitaké et carotte.",http://auptitcafe.nc/wp-content/uploads/2025/08/APC-MENU-DU-MARDI03.jpg
2025-08-05 12:38:06.649,Sugestion du soir-,3300,PLAT,"Raviole de bœuf braisé au miso, purée de pomme de terre à l'ail confit,bok shoï salade mélangée.",http://auptitcafe.nc/wp-content/uploads/2022/11/VISUEL-PHOTO.jpg
2025-08-05 12:38:06.649,MOELLEUX-,1200,DESSERT,"Moelleux pomme et pépites de chocolat,chantilly chocolat-marron,banane flambée au rhum,crumble.",http://auptitcafe.nc/wp-content/uploads/2025/08/APC-MENU-DU-MARDI04.jpg
2025-08-05 12:38:06.649,CREME BRULEE-,1200,DESSERT,"Crème brulée à la vanille,popcorn caramélisé.",http://auptitcafe.nc/wp-content/uploads/2025/08/APC-MENU-DU-MARDI05.jpg
2025-08-05 12:38:06.649,L'incontournable,1200,DESSERT,"Le cheese-cake maison du p’tit café, à la mangue et au fruit de la passion",http://auptitcafe.nc/wp-content/uploads/2024/11/24100406.jpg
2025-08-05 12:38:06.649,Le café gourmand,1100,DESSERT,"C’est une bonne alternative, servi avec 3 minis desserts du jour",http://auptitcafe.nc/wp-content/uploads/2025/07/APC-MENU-DU-MARDI07.jpg
