menu_date,titre_plat,prix,category,recette,image_url
2023-11-28 12:21:09.225,Plat côté Terre,3300,PLAT,"Tsukune de porc, udon aux légumes,salade de choux-radis-menthe, vinaigrette au sésame,kakiage, condiment miso-agrume.",http://auptitcafe.nc/wp-content/uploads/2023/11/23112800.jpg
2023-11-28 12:21:09.225,Plat côté Mer,3300,PLAT,"Pavé de saumon, crème d'épinard et oseille, gnocchi-artichaut-champignon-courgette-, juive poivron, salade d'herbes et endive,crumble kasha citron-sel.",http://auptitcafe.nc/wp-content/uploads/2023/11/23112801.jpg
2023-11-28 12:21:09.225,Plat Végétarien,2950,PLAT,"Gnocchi de pomme de terre-artichaut-champignon-courgette,salade de choux vinaigrette sésame, kakiage,condiment miso.",http://auptitcafe.nc/wp-content/uploads/2023/11/23112802.jpg
2023-11-28 12:21:09.225,Suggestion du mois,2650,PLAT,"Salade mélangé,houmous de pois chiche,focaccia, escabèche de fruits de mer, tentacule d'encornet pané aux épices.",http://auptitcafe.nc/wp-content/uploads/2023/11/23110703.jpg
2023-11-28 12:21:09.225,Suggestion du soir,3300,PLAT,"Raviole ouverte au boeuf tamarin-cacao, purée de patate douce au coco, citrouille rôtie, salade mélangée-copeaux de coco.",http://auptitcafe.nc/wp-content/uploads/2022/11/VISUEL-PHOTO.jpg
2023-11-28 12:21:09.225,PANNA COTTA,1200,DESSERT,"Panna cotta au chocolat au lait, figue rôtie miel-romarin, mousse châtaigne.",http://auptitcafe.nc/wp-content/uploads/2023/11/23112805.jpg
2023-11-28 12:21:09.225,BANOFFEE,1200,DESSERT,"Biscuit spéculos,compotée de banane au rhum,caramel beurre salé, chantilly,sorbet banane",http://auptitcafe.nc/wp-content/uploads/2023/11/23112804.jpg
2023-11-28 12:21:09.225,L'incontournable,1200,DESSERT,"Le cheese-cake maison du p’tit café, à la mangue et au fruit de la passion",http://auptitcafe.nc/wp-content/uploads/2022/11/APC-MENU-DU-MARDI06-scaled.jpg
2023-11-28 12:21:09.225,Le café gourmand,1100,DESSERT,"C’est une bonne alternative, servi avec 3 minis desserts du jour",http://auptitcafe.nc/wp-content/uploads/2023/09/APC-MENU-DU-MARDI06-2.jpg
